{
  "schemaVersion": 1,
  "catalogVersion": "2.1.0",
  "revision": "e2a3085cc9c2062c01151272bf63a67a4be8aac8",
  "generatedAt": "2026-10-09T18:35:27.000Z",
  "skills": [
    {
      "id": "api-and-interface-design",
      "name": "api-and-interface-design",
      "version": "1.0.0",
      "category": "Design & Architecture",
      "description": "Guides stable API and interface design with clear contracts that are hard to misuse. Use when designing REST or GraphQL endpoints, defining type contracts between modules, establishing boundaries between frontend and backend, or reviewing an existing API for consistency. Triggers (PT/EN): \"/api\", \"api and interface design\", \"design this endpoint\", \"define the API contract\", \"revisar a API\". Do NOT use for: backend business logic implementation, database schema design, or frontend component styling.",
      "license": "MIT",
      "attribution": [
        {
          "name": "addyosmani/agent-skills",
          "url": "https://github.com/addyosmani/agent-skills",
          "text": "addyosmani/agent-skills (MIT, Copyright 2025 Addy Osmani); catalog source revision e2a3085cc9c2062c01151272bf63a67a4be8aac8."
        }
      ],
      "entrypoint": "SKILL.md",
      "files": [
        {
          "path": "SKILL.md",
          "size": 15252,
          "sha256": "aceed3059d77f2ba92df9728aa39260276531a9f11b2579f9ed6302e063b8ce1"
        }
      ],
      "contentSha256": "623460661d3aa3a7999a24938ae47138d026f71c5f336a0d43c40f397c7144cf"
    },
    {
      "id": "browser-testing-with-devtools",
      "name": "browser-testing-with-devtools",
      "version": "1.0.0",
      "category": "Design & Architecture",
      "description": "Tests in real browsers via Chrome DevTools MCP. Use when building or debugging anything that runs in a browser — inspect the DOM, capture console errors, analyze network requests, profile performance, or verify visual output with real runtime data. Requires the chrome-devtools MCP server. Triggers (PT/EN): \"/browser\", \"browser testing with devtools\", \"test this page\", \"inspect the DOM\", \"testar no navegador\". Do NOT use for: unit testing, API testing, or headless browser automation (use Playwright instead).",
      "license": "MIT",
      "attribution": [
        {
          "name": "addyosmani/agent-skills",
          "url": "https://github.com/addyosmani/agent-skills",
          "text": "addyosmani/agent-skills (MIT, Copyright 2025 Addy Osmani); catalog source revision e2a3085cc9c2062c01151272bf63a67a4be8aac8."
        }
      ],
      "entrypoint": "SKILL.md",
      "files": [
        {
          "path": "SKILL.md",
          "size": 14843,
          "sha256": "3a84fa55e787aa4cfde8d9d5e0deba54dfebfff2fe206bc6871b8ac92b17d3e6"
        }
      ],
      "contentSha256": "f083998f0a02bf5345a0b468085f80b9fabad3e6fe9b9adccce1e4245a63ced1"
    },
    {
      "id": "ci-cd-and-automation",
      "name": "ci-cd-and-automation",
      "version": "1.0.0",
      "category": "Delivery & Repository",
      "description": "Automates CI/CD pipeline setup and maintenance. Use when setting up or modifying build and deployment pipelines, automating quality gates, configuring test runners in CI, or establishing deployment strategies. Triggers (PT/EN): \"/ci\", \"ci cd and automation\", \"set up the pipeline\", \"configure CI\", \"configurar o pipeline\". Do NOT use for: local development environment setup, application code logic, or cloud infrastructure provisioning.",
      "license": "MIT",
      "attribution": [
        {
          "name": "addyosmani/agent-skills",
          "url": "https://github.com/addyosmani/agent-skills",
          "text": "addyosmani/agent-skills (MIT, Copyright 2025 Addy Osmani); catalog source revision e2a3085cc9c2062c01151272bf63a67a4be8aac8."
        }
      ],
      "entrypoint": "SKILL.md",
      "files": [
        {
          "path": "SKILL.md",
          "size": 11678,
          "sha256": "f4aa4261adbfda28c52cfd4d55649fdcc7f39daaf6361f32fafa78eddf2ffb3a"
        }
      ],
      "contentSha256": "d9a237ae9e21dca1c565d304cc2dc42582f99c4693b711bdef8c637b9837ee4c"
    },
    {
      "id": "code-review-and-quality",
      "name": "code-review-and-quality",
      "version": "1.0.0",
      "category": "Code Quality & Testing",
      "description": "Conducts multi-axis code review (correctness, readability, architecture, security, performance) with severity labels (Blocker, Required, Optional, Nit, FYI). Use before merging any change, after a feature implementation, or when reviewing code from another agent or human. EN triggers: /review, code review, PR review, merge gate, five-axis review, severity labels. PT triggers: /revisar, revisão de código, revisão de PR, gate de merge. Do NOT use for: in-flight decisions on non-trivial work (that's /harden), single-line typo fixes, or when the user explicitly skips review.",
      "license": "MIT",
      "attribution": [
        {
          "name": "Runecraft",
          "url": "https://github.com/runecraftai/skills",
          "text": "Copyright Runecraft. Runecraft-authored; source revision e2a3085cc9c2062c01151272bf63a67a4be8aac8."
        }
      ],
      "entrypoint": "SKILL.md",
      "files": [
        {
          "path": "SKILL.md",
          "size": 18807,
          "sha256": "b3525bb09b68cd9a431775a649e8585dcf49fb0876d2b1e8d12b567d5a53bc74"
        }
      ],
      "contentSha256": "1bd68579ac373752eca8a2784c3c7ee6c688214989507e402f7dd0003142651e"
    },
    {
      "id": "code-simplification",
      "name": "code-simplification",
      "version": "1.0.0",
      "category": "Code Quality & Testing",
      "description": "Simplifies code for clarity while preserving exact behavior (Chesterton's Fence, Rule of 500). Use when refactoring without changing behavior, or when code has accumulated unnecessary complexity. EN triggers: /simplify, simplify this, reduce complexity, \"is this too clever?\", Chesterton's Fence. PT triggers: /simplificar, reduzir complexidade, código difícil de ler, fence de Chesterton. Do NOT use for: behavior-changing refactors (use /spec-driven to plan), bug fixes (use /debug or /test-driven-development), or one-off tweaks that don't reduce concept count.",
      "license": "MIT",
      "attribution": [
        {
          "name": "Runecraft",
          "url": "https://github.com/runecraftai/skills",
          "text": "Copyright Runecraft. Runecraft-authored; source revision e2a3085cc9c2062c01151272bf63a67a4be8aac8."
        }
      ],
      "entrypoint": "SKILL.md",
      "files": [
        {
          "path": "SKILL.md",
          "size": 13894,
          "sha256": "fe8355996c9d45bcf2bf841a6dbaa3a0f9037a44cc84e985c68695a684d9a1b8"
        }
      ],
      "contentSha256": "175022a93db95ce187c1e258b2655be4560c600557a5b2e79b47914a031414ea"
    },
    {
      "id": "constraint-driven-development",
      "name": "constraint-driven-development",
      "version": "1.0.0",
      "category": "Code Quality & Testing",
      "description": "Establishes a project's quality bar as a written contract and stops agents quietly lowering it. Interviews the user on which dimensions matter, supplies sane default thresholds, records everything in CONSTRAINTS.md, and watches the diff for a weakened bar — new @ts-ignore or eslint-disable suppressions, skipped or deleted tests, assertions stripped out, unimplemented stubs, thresholds edited down. Use when no quality bar is written down, when the user says \"set up constraints\" or \"define our standards\", when you need coverage or performance thresholds enforced, or when an agent keeps silencing checks to get to green. Triggers (PT/EN): \"/constraint\", \"constraint driven development\", \"set up constraints\", \"define our standards\", \"definir padrões\". Do NOT use for: code review (use code-review-and-quality), test strategy design (use test-driven-development), or linting configuration.",
      "license": "MIT",
      "attribution": [
        {
          "name": "addyosmani/agent-skills",
          "url": "https://github.com/addyosmani/agent-skills",
          "text": "addyosmani/agent-skills (MIT, Copyright 2025 Addy Osmani); catalog source revision e2a3085cc9c2062c01151272bf63a67a4be8aac8."
        }
      ],
      "entrypoint": "SKILL.md",
      "files": [
        {
          "path": "SKILL.md",
          "size": 21133,
          "sha256": "5809a72710b4e3c9d11fbbdc5f86ab33c5763ef73dd54fba0766b1de0f959ad3"
        }
      ],
      "contentSha256": "50fa6c0b8769a9514d908ac5d5fe9aa878ac6f6131f7f661a5144c1b550e548e"
    },
    {
      "id": "context-engineering",
      "name": "context-engineering",
      "version": "1.0.0",
      "category": "Agent Skills",
      "description": "Optimizes agent context setup so sessions start with the right information. Use when starting a new session, when agent output quality degrades, when switching between tasks, or when configuring rules files and project context for AI agents. Triggers (PT/EN): \"/context\", \"context engineering\", \"set up agent context\", \"configure rules\", \"configurar contexto\". Do NOT use for: application configuration, deployment setup, or feature implementation.",
      "license": "MIT",
      "attribution": [
        {
          "name": "addyosmani/agent-skills",
          "url": "https://github.com/addyosmani/agent-skills",
          "text": "addyosmani/agent-skills (MIT, Copyright 2025 Addy Osmani); catalog source revision e2a3085cc9c2062c01151272bf63a67a4be8aac8."
        }
      ],
      "entrypoint": "SKILL.md",
      "files": [
        {
          "path": "SKILL.md",
          "size": 15852,
          "sha256": "69c13b410b3a87584386263e645b9b86d45231c76532addd6844566fab6aebcf"
        }
      ],
      "contentSha256": "6b6ee5eea3bd7ecdaee3bf9be8590404fe8cdcf67dc2db928c58af6ccc0ef2ac"
    },
    {
      "id": "debugging-and-error-recovery",
      "name": "debugging-and-error-recovery",
      "version": "1.0.0",